{
  "$schema": "../packages/workspace/workspace-codegen-nx/src/generators/shared/workspace-schema.json",
  "scope": "@adhd",
  "groups": {
    "apigen":     { "description": "API generation toolchain — core, engine, plugins for TS->API" },
    "agent":      { "description": "AI agent runtime — orchestrator, providers, stores, MCP server" },
    "data":       { "description": "Data utilities — structures, transforms, query engine" },
    "decompile":  { "description": "Bytecode/bundle decompilation toolchain — CLI for reversing built JS artifacts" },
    "dispatch":   { "description": "Task dispatch — DAG-based execution planning and optimization" },
    "environment": { "description": "Environment management — specs, builders, core runtimes for Node, Python, and Rust" },
    "policy":     { "description": "Policy evaluation — spec, deciders, services and wiring for ABAC-style authorization" },
    "resilience": { "description": "Fail-safe primitives - persistent kill-switches and guards that protect callers and upstream services from compounding failures" },
    "stealth":    { "description": "Stealth browsing - CDP Chrome core library and the search entrypoint built on it" },
    "ui-react":   { "description": "React UI components — hooks, storybook config" },
    "workspace":  { "description": "Workspace tooling — generators, shared utilities" }
  },
  "kinds": {
    "base": {
      "class": "foundation",
      "description": "Zero internal cross-dependencies. Roots of the dep graph."
    },
    "core": {
      "class": "foundation",
      "description": "Depends only on base packages within the same group."
    },
    "engine": {
      "class": "foundation",
      "description": "Orchestration/wiring layer. Depends on base + core."
    },
    "store": {
      "class": "foundation",
      "description": "Persistence/storage. Depends on base + core."
    },
    "query": {
      "class": "foundation",
      "description": "Query/engine layer. Depends on base + core."
    },
    "plugin": {
      "class": "optional",
      "description": "Optional extension. Depends on base + core + store. Cannot import other optional packages."
    },
    "generator": {
      "class": "optional",
      "description": "Code generator. Depends on base + core. Cannot import other optional packages."
    },
    "types": {
      "class": "types",
      "description": "Pure type definitions. Always access:public. Zero internal deps."
    },
    "entrypoint": {
      "class": "entrypoint",
      "description": "Runnable artifact. Lives under entrypoint/. Can depend on any package class."
    }
  },
  "platforms": {
    "node":    { "description": "Node.js runtime. Can import node built-ins." },
    "browser": { "description": "Browser runtime. Can import DOM APIs." },
    "shared":  { "description": "Universal. Safe in both Node and browser. Zero platform-specific imports." }
  },
  "layers": {
    "shared":        { "description": "Foundation utilities — environment-agnostic" },
    "logic":         { "description": "Domain business rules" },
    "data":          { "description": "Data engines (query, storage)" },
    "entrypoints":   { "description": "CLI tools, servers, apps" },
    "ui-primitives": { "description": "Atomic visual units (Button, hooks)" },
    "ui-composites": { "description": "Complex pure-visual units (Cards)" },
    "components":    { "description": "UI meets Data — merge point" },
    "workflows":     { "description": "Multi-step stateful journeys" },
    "ai":            { "description": "AI agent runtime — orchestration, providers, stores, prompt/tool registries" },
    "mcp":           { "description": "MCP server/protocol surface — tool + resource exposure over MCP" }
  },
  "defaults": {
    "types": {
      "access": "public",
      "publish": true,
      "nxLayer": "shared",
      "platform": "shared"
    },
    "entrypoint": {
      "nxLayer": "entrypoints",
      "platform": "node",
      "access": "domain",
      "publish": false
    },
    "library": {
      "access": "domain",
      "publish": false
    }
  }
}
